{
  "metadata": {
    "sample": true,
    "source": "skills/dental-care/references/aoba-dental-floor-maps/README.md と既存PNG",
    "warning": "施設・地図自体が架空のサンプルです。座標は画像に合わせた推定値、距離は未実測です。",
    "distance_note": "距離はフロア図から作成した動作確認用の推定値です。実運用前に施設管理者が実測値へ置き換えてください。"
  },
  "canvas": {
    "width": 1586,
    "height": 992,
    "north": "up"
  },
  "maps": {
    "A-1": "../skills/dental-care/references/aoba-dental-floor-maps/maps/a-building-1f.png",
    "A-2": "../skills/dental-care/references/aoba-dental-floor-maps/maps/a-building-2f.png",
    "A-3": "../skills/dental-care/references/aoba-dental-floor-maps/maps/a-building-3f.png",
    "B-1": "../skills/dental-care/references/aoba-dental-floor-maps/maps/b-building-1f.png",
    "B-2": "../skills/dental-care/references/aoba-dental-floor-maps/maps/b-building-2f.png",
    "B-3": "../skills/dental-care/references/aoba-dental-floor-maps/maps/b-building-3f.png"
  },
  "nodes": [
    {
      "id": "a1_hall_left",
      "name": "A棟1階 主廊下",
      "aliases": [],
      "building": "A",
      "floor": "1",
      "x": 330,
      "y": 420,
      "description": "経路計算用の接続点"
    },
    {
      "id": "a1_hall_center_left",
      "name": "A棟1階 主廊下",
      "aliases": [],
      "building": "A",
      "floor": "1",
      "x": 700,
      "y": 420,
      "description": "経路計算用の接続点"
    },
    {
      "id": "a1_hall_center_right",
      "name": "A棟1階 主廊下",
      "aliases": [],
      "building": "A",
      "floor": "1",
      "x": 950,
      "y": 420,
      "description": "経路計算用の接続点"
    },
    {
      "id": "a1_hall_right",
      "name": "A棟1階 主廊下",
      "aliases": [],
      "building": "A",
      "floor": "1",
      "x": 1250,
      "y": 420,
      "description": "経路計算用の接続点"
    },
    {
      "id": "a1_connector",
      "name": "A棟1階 連絡通路",
      "aliases": [],
      "building": "A",
      "floor": "1",
      "x": 1510,
      "y": 420,
      "description": "経路計算用の接続点"
    },
    {
      "id": "a1_stairs",
      "name": "A棟1階 階段",
      "aliases": [
        "A棟1F階段",
        "A棟1階階段"
      ],
      "building": "A",
      "floor": "1",
      "x": 850,
      "y": 520,
      "description": ""
    },
    {
      "id": "a1_elevator",
      "name": "A棟1階 エレベーター",
      "aliases": [
        "A棟1Fエレベーター",
        "A棟1階エレベーター"
      ],
      "building": "A",
      "floor": "1",
      "x": 850,
      "y": 650,
      "description": ""
    },
    {
      "id": "a2_hall_left",
      "name": "A棟2階 主廊下",
      "aliases": [],
      "building": "A",
      "floor": "2",
      "x": 330,
      "y": 420,
      "description": "経路計算用の接続点"
    },
    {
      "id": "a2_hall_center_left",
      "name": "A棟2階 主廊下",
      "aliases": [],
      "building": "A",
      "floor": "2",
      "x": 700,
      "y": 420,
      "description": "経路計算用の接続点"
    },
    {
      "id": "a2_hall_center_right",
      "name": "A棟2階 主廊下",
      "aliases": [],
      "building": "A",
      "floor": "2",
      "x": 950,
      "y": 420,
      "description": "経路計算用の接続点"
    },
    {
      "id": "a2_hall_right",
      "name": "A棟2階 主廊下",
      "aliases": [],
      "building": "A",
      "floor": "2",
      "x": 1250,
      "y": 420,
      "description": "経路計算用の接続点"
    },
    {
      "id": "a2_connector",
      "name": "A棟2階 連絡通路",
      "aliases": [],
      "building": "A",
      "floor": "2",
      "x": 1510,
      "y": 420,
      "description": "経路計算用の接続点"
    },
    {
      "id": "a2_stairs",
      "name": "A棟2階 階段",
      "aliases": [
        "A棟2F階段",
        "A棟2階階段"
      ],
      "building": "A",
      "floor": "2",
      "x": 850,
      "y": 520,
      "description": ""
    },
    {
      "id": "a2_elevator",
      "name": "A棟2階 エレベーター",
      "aliases": [
        "A棟2Fエレベーター",
        "A棟2階エレベーター"
      ],
      "building": "A",
      "floor": "2",
      "x": 850,
      "y": 650,
      "description": ""
    },
    {
      "id": "a3_hall_left",
      "name": "A棟3階 主廊下",
      "aliases": [],
      "building": "A",
      "floor": "3",
      "x": 330,
      "y": 420,
      "description": "経路計算用の接続点"
    },
    {
      "id": "a3_hall_center_left",
      "name": "A棟3階 主廊下",
      "aliases": [],
      "building": "A",
      "floor": "3",
      "x": 700,
      "y": 420,
      "description": "経路計算用の接続点"
    },
    {
      "id": "a3_hall_center_right",
      "name": "A棟3階 主廊下",
      "aliases": [],
      "building": "A",
      "floor": "3",
      "x": 950,
      "y": 420,
      "description": "経路計算用の接続点"
    },
    {
      "id": "a3_hall_right",
      "name": "A棟3階 主廊下",
      "aliases": [],
      "building": "A",
      "floor": "3",
      "x": 1250,
      "y": 420,
      "description": "経路計算用の接続点"
    },
    {
      "id": "a3_connector",
      "name": "A棟3階 連絡通路",
      "aliases": [],
      "building": "A",
      "floor": "3",
      "x": 1510,
      "y": 420,
      "description": "経路計算用の接続点"
    },
    {
      "id": "a3_stairs",
      "name": "A棟3階 階段",
      "aliases": [
        "A棟3F階段",
        "A棟3階階段"
      ],
      "building": "A",
      "floor": "3",
      "x": 850,
      "y": 520,
      "description": ""
    },
    {
      "id": "a3_elevator",
      "name": "A棟3階 エレベーター",
      "aliases": [
        "A棟3Fエレベーター",
        "A棟3階エレベーター"
      ],
      "building": "A",
      "floor": "3",
      "x": 850,
      "y": 650,
      "description": ""
    },
    {
      "id": "b1_connector",
      "name": "B棟1階 連絡通路",
      "aliases": [],
      "building": "B",
      "floor": "1",
      "x": 40,
      "y": 420,
      "description": "経路計算用の接続点"
    },
    {
      "id": "b1_hall_left",
      "name": "B棟1階 主廊下",
      "aliases": [],
      "building": "B",
      "floor": "1",
      "x": 330,
      "y": 420,
      "description": "経路計算用の接続点"
    },
    {
      "id": "b1_hall_center_left",
      "name": "B棟1階 主廊下",
      "aliases": [],
      "building": "B",
      "floor": "1",
      "x": 700,
      "y": 420,
      "description": "経路計算用の接続点"
    },
    {
      "id": "b1_hall_center_right",
      "name": "B棟1階 主廊下",
      "aliases": [],
      "building": "B",
      "floor": "1",
      "x": 950,
      "y": 420,
      "description": "経路計算用の接続点"
    },
    {
      "id": "b1_hall_right",
      "name": "B棟1階 主廊下",
      "aliases": [],
      "building": "B",
      "floor": "1",
      "x": 1300,
      "y": 420,
      "description": "経路計算用の接続点"
    },
    {
      "id": "b1_stairs",
      "name": "B棟1階 階段",
      "aliases": [
        "B棟1F階段",
        "B棟1階階段"
      ],
      "building": "B",
      "floor": "1",
      "x": 850,
      "y": 520,
      "description": ""
    },
    {
      "id": "b1_elevator",
      "name": "B棟1階 エレベーター",
      "aliases": [
        "B棟1Fエレベーター",
        "B棟1階エレベーター"
      ],
      "building": "B",
      "floor": "1",
      "x": 850,
      "y": 650,
      "description": ""
    },
    {
      "id": "b2_connector",
      "name": "B棟2階 連絡通路",
      "aliases": [],
      "building": "B",
      "floor": "2",
      "x": 40,
      "y": 420,
      "description": "経路計算用の接続点"
    },
    {
      "id": "b2_hall_left",
      "name": "B棟2階 主廊下",
      "aliases": [],
      "building": "B",
      "floor": "2",
      "x": 330,
      "y": 420,
      "description": "経路計算用の接続点"
    },
    {
      "id": "b2_hall_center_left",
      "name": "B棟2階 主廊下",
      "aliases": [],
      "building": "B",
      "floor": "2",
      "x": 700,
      "y": 420,
      "description": "経路計算用の接続点"
    },
    {
      "id": "b2_hall_center_right",
      "name": "B棟2階 主廊下",
      "aliases": [],
      "building": "B",
      "floor": "2",
      "x": 950,
      "y": 420,
      "description": "経路計算用の接続点"
    },
    {
      "id": "b2_hall_right",
      "name": "B棟2階 主廊下",
      "aliases": [],
      "building": "B",
      "floor": "2",
      "x": 1300,
      "y": 420,
      "description": "経路計算用の接続点"
    },
    {
      "id": "b2_stairs",
      "name": "B棟2階 階段",
      "aliases": [
        "B棟2F階段",
        "B棟2階階段"
      ],
      "building": "B",
      "floor": "2",
      "x": 850,
      "y": 520,
      "description": ""
    },
    {
      "id": "b2_elevator",
      "name": "B棟2階 エレベーター",
      "aliases": [
        "B棟2Fエレベーター",
        "B棟2階エレベーター"
      ],
      "building": "B",
      "floor": "2",
      "x": 850,
      "y": 650,
      "description": ""
    },
    {
      "id": "b3_connector",
      "name": "B棟3階 連絡通路",
      "aliases": [],
      "building": "B",
      "floor": "3",
      "x": 40,
      "y": 420,
      "description": "経路計算用の接続点"
    },
    {
      "id": "b3_hall_left",
      "name": "B棟3階 主廊下",
      "aliases": [],
      "building": "B",
      "floor": "3",
      "x": 330,
      "y": 420,
      "description": "経路計算用の接続点"
    },
    {
      "id": "b3_hall_center_left",
      "name": "B棟3階 主廊下",
      "aliases": [],
      "building": "B",
      "floor": "3",
      "x": 700,
      "y": 420,
      "description": "経路計算用の接続点"
    },
    {
      "id": "b3_hall_center_right",
      "name": "B棟3階 主廊下",
      "aliases": [],
      "building": "B",
      "floor": "3",
      "x": 950,
      "y": 420,
      "description": "経路計算用の接続点"
    },
    {
      "id": "b3_hall_right",
      "name": "B棟3階 主廊下",
      "aliases": [],
      "building": "B",
      "floor": "3",
      "x": 1300,
      "y": 420,
      "description": "経路計算用の接続点"
    },
    {
      "id": "b3_stairs",
      "name": "B棟3階 階段",
      "aliases": [
        "B棟3F階段",
        "B棟3階階段"
      ],
      "building": "B",
      "floor": "3",
      "x": 850,
      "y": 520,
      "description": ""
    },
    {
      "id": "b3_elevator",
      "name": "B棟3階 エレベーター",
      "aliases": [
        "B棟3Fエレベーター",
        "B棟3階エレベーター"
      ],
      "building": "B",
      "floor": "3",
      "x": 850,
      "y": 650,
      "description": ""
    },
    {
      "id": "a1_entrance",
      "name": "A棟1階 正面入口",
      "aliases": [
        "正面入口",
        "正面玄関",
        "現在地",
        "A棟入口",
        "A棟1F入口"
      ],
      "building": "A",
      "floor": "1",
      "x": 850,
      "y": 830,
      "description": "一般来院者の入口"
    },
    {